{
  "message_id": "01a0b1c2-4a14-7001-8002-0a0b0c0d0e0f",
  "message_type": "SESSION_READY",
  "schema_version": 1,
  "tick": 1200,
  "correlation_id": "01a0b1c2-4a12-7c01-8d02-1e033f044a05",
  "payload": {
    "session_id": "01a0b1c2-4a11-7b22-9c33-0d44e55f6a77",
    "world_id": "01a0b1c2-3d4e-7f01-8a2b-9c0d1e2f3a4b",
    "actor_id": "01a0b1c2-2c01-7a45-8b67-89abcdef0123",
    "tick_hz": 20,
    "server_version": "0.1.0"
  }
}
